City,Hotel Name,Hotel Address,Average Rating,Number of Reviews,Cost of Stay,Provider
Orlando,Hilton Grand Vacations at SeaWorld,"6924 Grand Vacations Way, Orlando, FL 32821",8.9,"2,860",599,Expedia
Orlando,Rosen Inn Closest to Universal,"6327 International Drive, Orlando, FL 32819",8.3,"4,791",326,Rosen Inn Closest to Universal
Orlando,Hyatt Regency Orlando,"9801 International Drive, Orlando, FL 32819",8.9,"2,937",801,Expedia
Orlando,Exceptional Vista Cay Condo Neartheme Parks. Walk To Conventions,,9.8,19,"1,105",Hotels.com
Orlando,"Sheraton Vistana Villages Resort Villas, I-Drive/Orlando","12401 International Drive, Orlando, FL 32821",8.9,"1,976",462,Expedia
Orlando,DoubleTree by Hilton at the Entrance to Universal Orlando,"5780 Major Boulevard, Orlando, FL 32819",8.2,"5,332",440,Booking.com
Orlando,Parc Soleil by Hilton Grand Vacations,"11272 Desforges Avenue, Orlando, FL 32836",9.0,253,692,Expedia
Orlando,Rosen Shingle Creek,"9939 Universal Boulevard, Orlando, FL 32819",9.1,"1,493",642,Expedia
Orlando,Wqr Private Rentals,,8.5,113,493,Booking.com
Orlando,Castle Hotel Autograph Collection,"8602 Universal Boulevard, Orlando, FL 32819",8.3,"1,393",506,Hotels.com
Orlando,Delta Hotels by Marriott Orlando Lake Buena Vista,"12490 South Apopka Vineland Road, Orlando, FL 32836",8.1,"1,100",440,Expedia
Orlando,Hilton Orlando,"6001 Destination Parkway, Orlando, FL 32819",8.4,887,816,Expedia
Orlando,Marriott's Cypress Harbour Villas,"11251 Harbour Villa Road, Orlando, FL 32821",9.4,337,717,Expedia
Orlando,Cardif Castle,,8.2,17,742,Booking.com
Orlando,Lake Buena Vista Resort Village & Spa,"8113 Resort Village Drive, Orlando, FL 32821",8.2,"2,795",898,Lake Buena Vista Resort Village & Spa
Orlando,Renaissance Orlando at SeaWorld,"6677 Sea Harbor Drive, Orlando, FL 32821",8.7,"1,387",756,Expedia
Orlando,Perfect Orlando Home! Cozy and Contemporary 3bd/3.5ba Town Home - #3vc013,,9.2,14,877,Hotels.com
Orlando,Las Palmeras by Hilton Grand Vacations,"9501 Universal Boulevard, Orlando, FL 32819",9.0,335,927,Hotels.com
